{
  "$schema": "http://json-schema.org/draft-07/schema#",
  "title": "Preset",
  "type": "object",
  "properties": {
    "filename": { "type": "string" },
    "type": { "type": "string" },
    "title": { "type": "string" },
    "description": { "type": "string" },
    "pipeline_root": { "type": "string" },
    "pipelines": {
      "type": "array",
      "items": { "type": "string" }
    },
    "parameter_root": { "type": "string" },
    "parameter_sets": {
      "type": "array",
      "items": { "type": "string" }
    },
    "parameter_overrides": {
      "type": "object",
      "additionalProperties": true
    }
  },
  "required": [
    "filename",
    "type",
    "title",
    "description",
    "pipeline_root",
    "pipelines"
  ],
  "additionalProperties": true
}
