{
  "filename" : "3do",
  "type" : "consumer",
  "title" : "3DO composite shader set",
  "description" : "Composite output is available on all 3DO models with the included cable.",
  "pipeline_root" : "../../pipelines",
  "pipelines" : [
    "sys/3do-special.json",
    "misc/menu-digital-composite-upsample.json",
    "misc/frame-digital-780.json",
    "sys/digital-composite.json",
    "disp/crt.json",
    "misc/post.json"
  ],
  "parameter_root" : "../../params",
  "parameter_sets" : [
    "sys/3do/base.json",
    "sys/3do/ntsc.json",
    "sys/3do/composite.json",
    "disp/ntscj.json",
    "disp/trinitron.json",
    "disp/consumer-color-ntsc.json",
    "disp/tvl-450.json"
  ],
  "parameter_overrides" : {
  }
}
