{
  "filename" : "md-gb-rf",
  "type" : "professional",
  "title" : "Mega Drive RF shader set (PAL-I)",
  "description" : "United Kingdom and commonwealth countries used PAL-I, which has higher bandwidth than PAL-G.",
  "pipeline_root" : "../../pipelines",
  "pipelines" : [
    "misc/menu-rf-yc.json",
    "misc/frame-tv625.json",
    "sys/yc-rf.json",
    "disp/crt-625.json",
    "misc/post.json"
  ],
  "parameter_root" : "../../params",
  "parameter_sets" : [
    "sys/md/base.json",
    "sys/md/pal.json",
    "misc/rf-pali.json",
    "disp/pal.json",
    "disp/trinitron.json",
    "disp/deflicker.json",
    "disp/tvl-600.json"
  ],
  "parameter_overrides" : {
  }
}