{
  "filename" : "3do-eu-composite",
  "type" : "professional",
  "title" : "3DO composite shader set (PAL)",
  "description" : "Composite video output is the standard output on all 3DO models.",
  "pipeline_root" : "../../pipelines",
  "pipelines" : [
    "sys/3do-special.json",
    "misc/menu-composite-direct.json",
    "misc/frame-tv625.json",
    "sys/direct-composite.json",
    "disp/crt.json",
    "misc/post.json"
  ],
  "parameter_root" : "../../params",
  "parameter_sets" : [
    "sys/3do/base.json",
    "sys/3do/pal.json",
    "disp/pal.json",
    "disp/trinitron.json",
    "disp/deflicker.json",
    "disp/tvl-600.json"
  ],
  "parameter_overrides" : {
  }
}
