{
  "filename" : "snes-eu",
  "type" : "consumer",
  "title" : "SNES composite shader set (PAL)",
  "description" : "All models included an A/V cable with the console.  French consoles included a composite to RGB converter (despite the console having native RGB output).",
  "pipeline_root" : "../../pipelines",
  "pipelines" : [
    "misc/menu-composite.json",
    "misc/frame-tv625.json",
    "sys/component-composite.json",
    "disp/crt.json",
    "misc/post.json"
  ],
  "parameter_root" : "../../params",
  "parameter_sets" : [
    "sys/sfc/base.json",
    "sys/sfc/pal.json",
    "disp/pal.json",
    "disp/tv.json",
    "disp/consumer-color-pal.json",
    "disp/tvl-450.json"
  ],
  "parameter_overrides" : {
  }
}
