{
  "filename" : "psx-eu-svideo",
  "type" : "professional",
  "title" : "PlayStation S-Video shader set (PAL)",
  "description" : "S-Video was available on all PSX models.",
  "pipeline_root" : "../../pipelines",
  "pipelines" : [
    "misc/menu-svideo.json",
    "misc/frame-tv625.json",
    "sys/svideo.json",
    "disp/crt.json",
    "misc/post.json"
  ],
  "parameter_root" : "../../params",
  "parameter_sets" : [
    "sys/psx/base.json",
    "sys/psx/pal.json",
    "disp/pal.json",
    "disp/trinitron.json",
    "disp/deflicker.json",
    "disp/tvl-600.json"
  ],
  "parameter_overrides" : {
  }
}
