{
  "filename" : "gen",
  "type" : "professional",
  "title" : "Genesis composite shader set",
  "description" : "A/V was included for all NTSC consoles.",
  "pipeline_root" : "../../pipelines",
  "pipelines" : [
    "misc/menu-composite-yc.json",
    "misc/frame-tv525.json",
    "sys/yc-composite.json",
    "disp/crt.json",
    "misc/post.json"
  ],
  "parameter_root" : "../../params",
  "parameter_sets" : [
    "sys/md/base.json",
    "sys/md/ntsc.json",
    "disp/ntsc.json",
    "disp/trinitron.json",
    "disp/tvl-600.json"
  ],
  "parameter_overrides" : {
  }
}
