{
  "filename" : "famicom",
  "type" : "consumer",
  "title" : "Famicom RF shader set",
  "description" : "The original Famicom was RF only",
  "pipeline_root" : "../../pipelines",
  "pipelines" : [
    "sys/famicom-rf.json",
    "disp/crt.json",
    "misc/post.json"
  ],
  "parameter_root" : "../../params",
  "parameter_sets" : [
    "sys/sfc/base.json",
    "sys/sfc/ntsc.json",
    "misc/rf-ntsc.json",
    "disp/ntscj.json",
    "disp/trinitron.json",
    "disp/consumer-color-ntsc.json",
    "disp/tvl-300.json"
  ],
  "parameter_overrides" : {
  }
}
