{
  "filename" : "md-fr_md2-eu",
  "type" : "professional",
  "title" : "Mega Drive RGB shader set",
  "description" : "RGB was officially supported in France, however RGB output is available on most Mega Drives.  An official cable was released for all European Mega Drive IIs.",
  "pipeline_root" : "../../pipelines",
  "pipelines" : [
    "misc/menu.json",
    "misc/frame-tv625.json",
    "sys/rgb.json",
    "disp/crt.json",
    "misc/post.json"
  ],
  "parameter_root" : "../../params",
  "parameter_sets" : [
    "sys/md/base.json",
    "sys/md/pal.json",
    "disp/pal.json",
    "disp/trinitron.json",
    "disp/deflicker.json",
    "disp/tvl-600.json"
  ],
  "parameter_overrides" : {
  }
}
