{
  "filename" : "3do-us",
  "type" : "professional",
  "title" : "3DO S-Video shader set (NTSC-M)",
  "description" : "S-Video output is available on all 3DO models with the appropriate cable.",
  "pipeline_root" : "../../pipelines",
  "pipelines" : [
    "sys/3do-special.json",
    "misc/menu-digital-video-upsample.json",
    "misc/frame-digital-780.json",
    "sys/digital-svideo.json",
    "disp/crt.json",
    "misc/post.json"
  ],
  "parameter_root" : "../../params",
  "parameter_sets" : [
    "sys/3do/base.json",
    "sys/3do/ntsc.json",
    "sys/3do/svideo.json",
    "disp/ntsc.json",
    "disp/trinitron.json",
    "disp/tvl-600.json"
  ],
  "parameter_overrides" : {
  }
}
