{
  "filename" : "snes_snesmini",
  "type" : "consumer",
  "title" : "SNES composite shader set",
  "description" : "All models included an A/V cable with the console.",
  "pipeline_root" : "../../pipelines",
  "pipelines" : [
    "misc/menu-composite.json",
    "misc/frame-tv525.json",
    "sys/component-composite.json",
    "disp/crt.json",
    "misc/post.json"
  ],
  "parameter_root" : "../../params",
  "parameter_sets" : [
    "sys/sfc/base.json",
    "sys/sfc/ntsc.json",
    "disp/ntsc.json",
    "disp/tv.json",
    "disp/consumer-color-ntsc.json",
    "disp/tvl-450.json"
  ],
  "parameter_overrides" : {
  }
}
